<?xml version="1.0" encoding="utf-8" ?>
<!DOCTYPE configuration
        SYSTEM "xrpc-framework/xrpc-core/src/main/java/com/meiya/builder/xml/xrpc-bootstrap-config.dtd">
<configuration>


    <port>8082</port>

    <applicationName>app-default-name</applicationName>

    <registryConfig connect="zookeeper://127.0.0.1:2181"/>

<!--    三选一  优先级:自定义class > 带参数 > 文本 -->
    <serializeType type="hessian"/>
    <serializeType>json</serializeType>
    <serializer class="com.meiya.serialize.impl.HessianSerializer" name="hessian" num="4"/>

    <compressType>gzip</compressType>
    <compressor class="com.meiya.compress.impl.GzipCompressor" name="gzip" num="4"/>
    <compressType>gzip</compressType>





    <idGenerator class="com.meiya.utils.IdGenerator" dataCenterId="3" machineId="4"/>
</configuration>